<?xml version="1.0" encoding="UTF-8"?>
<dataroot xmlns:od="urn:schemas-microsoft-com:officedata" xmlns:xsi="http://www.w3.org/2001/XMLSchema-instance"  xsi:noNamespaceSchemaLocation="fermentables.xsd" generated="2020-05-24T17:36:11">
<fermentables>
<Grain>Apple Juice</Grain>
<Origin>N/A</Origin>
<Color>5</Color>
<Mash_x003F_>-</Mash_x003F_>
<Potential>1.05</Potential>
<Max_x00A0__x0025_>1</Max_x00A0__x0025_>
<Notes>Juice. Really it&apos;s hard cider if you&apos;re using 100%. </Notes>
<Power>0</Power>
<PH>3.675</PH>
</fermentables>
<fermentables>
<Grain>Amber Malt</Grain>
<Origin>United Kingdom</Origin>
<Color>22</Color>
<Mash_x003F_>X</Mash_x003F_>
<Potential>1.035</Potential>
<Max_x00A0__x0025_>0.2</Max_x00A0__x0025_>
<Notes>Roasted specialty malt used in some English browns, milds and old ales to add color and a biscuit taste. Intense flavor - so limit use. Low diastatic power so must be mashed with well modified malts.</Notes>
<Power>20</Power>
<PH>5.5</PH>
</fermentables>
<fermentables>
<Grain>Aromatic Malt</Grain>
<Origin>Belgium</Origin>
<Color>26</Color>
<Mash_x003F_>X</Mash_x003F_>
<Potential>1.036</Potential>
<Max_x00A0__x0025_>0.1</Max_x00A0__x0025_>
<Notes>Provides a very strong malt flavor and aroma to your beer.</Notes>
<Power>29</Power>
<PH>5.7</PH>
</fermentables>
<fermentables>
<Grain>Barley, Flaked</Grain>
<Origin>US</Origin>
<Color>1.7</Color>
<Mash_x003F_>X</Mash_x003F_>
<Potential>1.032</Potential>
<Max_x00A0__x0025_>0.2</Max_x00A0__x0025_>
<Notes>Adds significant body to Porters and Stouts. High haze producing protein prevents use in light beers.</Notes>
<Power>0</Power>
<PH>5.7</PH>
</fermentables>
<fermentables>
<Grain>Barley, Raw</Grain>
<Origin>US</Origin>
<Color>2</Color>
<Mash_x003F_>X</Mash_x003F_>
<Potential>1.028</Potential>
<Max_x00A0__x0025_>0.15</Max_x00A0__x0025_>
<Notes>Raw, unmalted barley can be used to add body to your beer. Use in homebrew requires very fine milling combined with a decoction or multi-stage mash. Performs best when used in small quantities with well modified grains.</Notes>
<Power>0</Power>
<PH>5.7</PH>
</fermentables>
<fermentables>
<Grain>Barley, Roasted</Grain>
<Origin>US</Origin>
<Color>300</Color>
<Mash_x003F_>-</Mash_x003F_>
<Potential>1.025</Potential>
<Max_x00A0__x0025_>0.1</Max_x00A0__x0025_>
<Notes>Roasted at high temperature to create a burnt, grainy, coffee like flavor. Imparts a red to deep brown color to beer, and very strong roasted flavor. Use 2-4% in Brown ales to add a nutty flavor, or 3-10% in Porters and Stouts for coffee flavor.</Notes>
<Power>0</Power>
<PH>4.71</PH>
</fermentables>
<fermentables>
<Grain>Barley, Torrefied</Grain>
<Origin>US</Origin>
<Color>1.7</Color>
<Mash_x003F_>X</Mash_x003F_>
<Potential>1.036</Potential>
<Max_x00A0__x0025_>0.4</Max_x00A0__x0025_>
<Notes>Raw barley that has been &quot;popped&quot; open to open kernels Used in place of raw barley for faster conversion and higher yields. High in haze producing protein</Notes>
<Power>0</Power>
<PH>5.7</PH>
</fermentables>
<fermentables>
<Grain>Belgian Debittered Black Malt</Grain>
<Origin>Belgian</Origin>
<Color>550</Color>
<Mash_x003F_>-</Mash_x003F_>
<Potential>1.01</Potential>
<Max_x00A0__x0025_>0.1</Max_x00A0__x0025_>
<Notes>-</Notes>
<Power>0</Power>
<PH>4.71</PH>
</fermentables>
<fermentables>
<Grain>Biscuit Malt</Grain>
<Origin>United Kingdom</Origin>
<Color>23</Color>
<Mash_x003F_>X</Mash_x003F_>
<Potential>1.036</Potential>
<Max_x00A0__x0025_>0.1</Max_x00A0__x0025_>
<Notes>Use for English ales, brown ales and porters. Adds a biscuit like flavor and aroma. Can be used as a substitute for toasted malt.</Notes>
<Power>6</Power>
<PH>5.7</PH>
</fermentables>
<fermentables>
<Grain>Black (Patent) Malt</Grain>
<Origin>US</Origin>
<Color>500</Color>
<Mash_x003F_>-</Mash_x003F_>
<Potential>1.025</Potential>
<Max_x00A0__x0025_>0.1</Max_x00A0__x0025_>
<Notes>Dark color and dry roasted flavor characteristic of Stouts and Porters Use for: Coloring in small amounts, or flavoring of Stouts and Porters in larger amounts.</Notes>
<Power>0</Power>
<PH>4.71</PH>
</fermentables>
<fermentables>
<Grain>Black Barley (Briess)</Grain>
<Origin>US</Origin>
<Color>500</Color>
<Mash_x003F_>-</Mash_x003F_>
<Potential>1.032</Potential>
<Max_x00A0__x0025_>1</Max_x00A0__x0025_>
<Notes>-</Notes>
<Power>0</Power>
<PH>4.71</PH>
</fermentables>
<fermentables>
<Grain>Black Barley (Stout)</Grain>
<Origin>US</Origin>
<Color>500</Color>
<Mash_x003F_>-</Mash_x003F_>
<Potential>1.025</Potential>
<Max_x00A0__x0025_>0.1</Max_x00A0__x0025_>
<Notes>Unmalted barley roasted at high temperature to create a dry, coffee like flavor. Imparts a sharp acrid flavor characteristic of dry stouts. Gives &quot;dryness&quot; to a stout or porter -- much more so than regular Roasted Barley</Notes>
<Power>0</Power>
<PH>4.71</PH>
</fermentables>
<fermentables>
<Grain>Blackprinz Malt</Grain>
<Origin>US</Origin>
<Color>500</Color>
<Mash_x003F_>-</Mash_x003F_>
<Potential>1.025</Potential>
<Max_x00A0__x0025_>0.1</Max_x00A0__x0025_>
<Notes>Dark color and dry roasted flavor characteristic of Stouts and Porters Use for: Coloring in small amounts, or flavoring of Stouts and Porters in larger amounts.</Notes>
<Power>0</Power>
<PH>4.71</PH>
</fermentables>
<fermentables>
<Grain>Blackprinz Malt (Briess)</Grain>
<Origin>US</Origin>
<Color>500</Color>
<Mash_x003F_>-</Mash_x003F_>
<Potential>1.033</Potential>
<Max_x00A0__x0025_>0.1</Max_x00A0__x0025_>
<Notes>Dehusked Black Malt, similar to Weyermann CARAFA® Special. Very delicate roasted flavors. No astrigent or bitter aftertaste. Color: 500 L</Notes>
<Power>0</Power>
<PH>4.71</PH>
</fermentables>
<fermentables>
<Grain>Brewers Malt 6-Row (Briess)</Grain>
<Origin>US</Origin>
<Color>1.8</Color>
<Mash_x003F_>-</Mash_x003F_>
<Potential>1.036</Potential>
<Max_x00A0__x0025_>1</Max_x00A0__x0025_>
<Notes>Flavor:Mild Grainy Malty More husk than 2-row, well suited for high adjunct brewing</Notes>
<Power>160</Power>
<PH>5.7</PH>
</fermentables>
<fermentables>
<Grain>Brown Malt</Grain>
<Origin>United Kingdom</Origin>
<Color>65</Color>
<Mash_x003F_>X</Mash_x003F_>
<Potential>1.032</Potential>
<Max_x00A0__x0025_>0.1</Max_x00A0__x0025_>
<Notes>Imparts a dry, biscuit flavor. Used in nut brown ales, porters and some Belgian ales.</Notes>
<Power>0</Power>
<PH>5.7</PH>
</fermentables>
<fermentables>
<Grain>Brown Sugar, Light</Grain>
<Origin>-</Origin>
<Color>10</Color>
<Mash_x003F_>-</Mash_x003F_>
<Potential>1.035</Potential>
<Max_x00A0__x0025_>0.1</Max_x00A0__x0025_>
<Notes>Sugar. Caramel notes.</Notes>
<Power>0</Power>
<PH>5.7</PH>
</fermentables>
<fermentables>
<Grain>Brown Sugar, Dark</Grain>
<Origin>-</Origin>
<Color>20</Color>
<Mash_x003F_>-</Mash_x003F_>
<Potential>1.035</Potential>
<Max_x00A0__x0025_>0.1</Max_x00A0__x0025_>
<Notes>Sugar. Caramel notes. More intense than other sugars</Notes>
<Power>0</Power>
<PH>5.7</PH>
</fermentables>
<fermentables>
<Grain>Brumalt</Grain>
<Origin>Germany</Origin>
<Color>23</Color>
<Mash_x003F_>X</Mash_x003F_>
<Potential>1.033</Potential>
<Max_x00A0__x0025_>0.1</Max_x00A0__x0025_>
<Notes>Dark German malt developed to add malt flavor of Alt, Marzen and Oktoberfest beers. Helps create authentic maltiness without having to do a decoction mash. Rarely available for homebrewers.</Notes>
<Power>0</Power>
<PH>5.7</PH>
</fermentables>
<fermentables>
<Grain>Cara-Pils/Dextrine</Grain>
<Origin>US</Origin>
<Color>2</Color>
<Mash_x003F_>-</Mash_x003F_>
<Potential>1.033</Potential>
<Max_x00A0__x0025_>0.2</Max_x00A0__x0025_>
<Notes>Significantly increases foam/head retention and body of the beer. Also sold under the names &quot;Dextrine&quot; and &quot;Cara-Foam&quot;</Notes>
<Power>0</Power>
<PH>5.7</PH>
</fermentables>
<fermentables>
<Grain>Caraamber</Grain>
<Origin>US</Origin>
<Color>30</Color>
<Mash_x003F_>-</Mash_x003F_>
<Potential>1.035</Potential>
<Max_x00A0__x0025_>0.2</Max_x00A0__x0025_>
<Notes>Adds body, color and improves head retention. Also called &quot;Crystal&quot; malt.</Notes>
<Power>0</Power>
<PH>5.7</PH>
</fermentables>
<fermentables>
<Grain>Caraaroma</Grain>
<Origin>Germany</Origin>
<Color>130</Color>
<Mash_x003F_>-</Mash_x003F_>
<Potential>1.035</Potential>
<Max_x00A0__x0025_>0.15</Max_x00A0__x0025_>
<Notes>Very dark crystal malt - similar to a crystal 120 or Caramunich 120 malt. Adds strong caramel flavor, red color, and malty aroma.</Notes>
<Power>0</Power>
<PH>4.71</PH>
</fermentables>
<fermentables>
<Grain>Carafa I</Grain>
<Origin>Germany</Origin>
<Color>337</Color>
<Mash_x003F_>-</Mash_x003F_>
<Potential>1.032</Potential>
<Max_x00A0__x0025_>0.05</Max_x00A0__x0025_>
<Notes>Used to intensify aroma and color in dark, Munich beers and stouts.</Notes>
<Power>0</Power>
<PH>4.71</PH>
</fermentables>
<fermentables>
<Grain>Carafa I (Weyermann)</Grain>
<Origin>Germany</Origin>
<Color>320</Color>
<Mash_x003F_>-</Mash_x003F_>
<Potential>1.036</Potential>
<Max_x00A0__x0025_>0.05</Max_x00A0__x0025_>
<Notes>Chocolate malt. Dark beers, Alts, Bockbiers. Adds color and aroma. </Notes>
<Power>0</Power>
<PH>4.71</PH>
</fermentables>
<fermentables>
<Grain>Carafa II</Grain>
<Origin>Germany</Origin>
<Color>412</Color>
<Mash_x003F_>-</Mash_x003F_>
<Potential>1.032</Potential>
<Max_x00A0__x0025_>0.05</Max_x00A0__x0025_>
<Notes>Used to intensify aroma and color in dark, Munich beers and stouts.</Notes>
<Power>0</Power>
<PH>4.71</PH>
</fermentables>
<fermentables>
<Grain>Carafa III</Grain>
<Origin>Germany</Origin>
<Color>525</Color>
<Mash_x003F_>-</Mash_x003F_>
<Potential>1.032</Potential>
<Max_x00A0__x0025_>0.05</Max_x00A0__x0025_>
<Notes>Dark color and aroma - used in some German beers</Notes>
<Power>0</Power>
<PH>4.71</PH>
</fermentables>
<fermentables>
<Grain>Carafa Special I (Weyermann)</Grain>
<Origin>Germany</Origin>
<Color>320</Color>
<Mash_x003F_>-</Mash_x003F_>
<Potential>1.036</Potential>
<Max_x00A0__x0025_>0.05</Max_x00A0__x0025_>
<Notes>Chocolate malt. Dark beers, Alts, Bockbiers. Adds color and aroma. De-husked, smoother tasting</Notes>
<Power>0</Power>